{
  "epic": {
    "title": "AI-Powered Product Recommendations",
    "description": "Develop and integrate an AI-driven product recommendation system into the e-commerce platform to enhance user experience and increase engagement through personalized, real-time suggestions.",
    "labels": [
      {
        "name": "ai",
        "type": "epic"
      },
      {
        "name": "recommendations",
        "type": "epic"
      },
      {
        "name": "e-commerce",
        "type": "epic"
      }
    ],
    "features": [
      "Personalized Product Recommendation Engine"
    ]
  },
  "stories": [
    {
      "id": "story-1",
      "title": "Implement Personalized Product Recommendation Engine",
      "description": "Build and deploy an AI-driven recommendation engine that suggests relevant products to authenticated users based on their browsing and purchase history, updating in real-time.",
      "acceptanceCriteria": [
        "Display at least 5 relevant product recommendations on the homepage for logged-in users.",
        "Update recommendations in real-time based on the user's recent interactions.",
        "Achieve at least a 70% click-through rate in A/B testing compared to baseline.",
        "Do not display recommendations to unauthenticated users.",
        "Load recommendations within 500ms for at least 95% of requests.",
        "System must handle concurrent requests from up to 10,000 users.",
        "Ensure GDPR and CCPA compliance for data privacy."
      ],
      "tasks": [
        {
          "title": "Integrate with User Authentication System",
          "description": "Ensure only authenticated users receive personalized recommendations by integrating the engine with the platform's authentication system.",
          "labels": [
            {
              "name": "backend",
              "type": "task"
            },
            {
              "name": "security",
              "type": "task"
            }
          ],
          "feature": "Personalized Product Recommendation Engine",
          "epic": "AI-Powered Product Recommendations"
        },
        {
          "title": "Access and Process User Profile & Purchase History Data",
          "description": "Retrieve and process relevant data from existing user profiles and purchase history databases for input into the recommendation model.",
          "labels": [
            {
              "name": "backend",
              "type": "task"
            },
            {
              "name": "data",
              "type": "task"
            }
          ],
          "feature": "Personalized Product Recommendation Engine",
          "epic": "AI-Powered Product Recommendations"
        },
        {
          "title": "Integrate with Product Catalog API",
          "description": "Connect the recommendation engine to the product catalog API to fetch current product data.",
          "labels": [
            {
              "name": "backend",
              "type": "task"
            },
            {
              "name": "api",
              "type": "task"
            }
          ],
          "feature": "Personalized Product Recommendation Engine",
          "epic": "AI-Powered Product Recommendations"
        },
        {
          "title": "Develop & Train Machine Learning Model",
          "description": "Create, train, and validate the AI model to generate product recommendations based on user data.",
          "labels": [
            {
              "name": "ai",
              "type": "task"
            },
            {
              "name": "ml",
              "type": "task"
            },
            {
              "name": "data-science",
              "type": "task"
            }
          ],
          "feature": "Personalized Product Recommendation Engine",
          "epic": "AI-Powered Product Recommendations"
        },
        {
          "title": "Optimize Performance for Speed & Scalability",
          "description": "Ensure the recommendation system responds within 500ms and can handle 10,000 concurrent users.",
          "labels": [
            {
              "name": "performance",
              "type": "task"
            },
            {
              "name": "backend",
              "type": "task"
            }
          ],
          "feature": "Personalized Product Recommendation Engine",
          "epic": "AI-Powered Product Recommendations"
        },
        {
          "title": "Implement GDPR and CCPA Compliance",
          "description": "Ensure all data used by the recommendation engine adheres to GDPR and CCPA requirements.",
          "labels": [
            {
              "name": "compliance",
              "type": "task"
            },
            {
              "name": "security",
              "type": "task"
            }
          ],
          "feature": "Personalized Product Recommendation Engine",
          "epic": "AI-Powered Product Recommendations"
        }
      ],
      "priority": "High",
      "labels": [
        {
          "name": "ai",
          "type": "story"
        },
        {
          "name": "recommendations",
          "type": "story"
        },
        {
          "name": "frontend",
          "type": "story"
        },
        {
          "name": "backend",
          "type": "story"
        }
      ],
      "feature": "Personalized Product Recommendation Engine",
      "epic": "AI-Powered Product Recommendations"
    }
  ],
  "notes": "Revised per feedback: Please revise the user stories based on these edited changes:\n\n\ud83c\udfaf **Story Agent - User Stories Generated!**\n\n## Epic: AI-Powered Product Recommendations\nDevelop and integrate an AI-driven product recommendation system into the e-commerce platform to enhance user experience and increase engagement through personalized, real-time suggestions.\n\n**Features:**\n- Personalized Product Recommendation Engine\n\n**Labels:** ai epic, recommendations epic, e-commerce epic\n\n## User Stories\n\n### 1. Implement Personalized Product Recommendation Engine\n**Description:** Build and deploy an AI-driven recommendation engine that suggests relevant products to authenticated users based on their browsing and purchase history, updating in real-time.\n\n**Acceptance Criteria:**\n- Display at least 5 relevant product recommendations on the homepage for logged-in users.\n- Update recommendations in real-time based on the user's recent interactions.\n- Achieve at least a 70% click-through rate in A/B testing compared to baseline.\n- Do not display recommendations to unauthenticated users.\n- Load recommendations within 500ms for at least 95% of requests.\n- System must handle concurrent requests from up to 10,000 users.\n- Ensure GDPR and CCPA compliance for data privacy.\n\n**Tasks:**\n- **Integrate with User Authentication System**: Ensure only authenticated users receive personalized recommendations by integrating the engine with the platform's authentication system.\n  Feature: Personalized Product Recommendation Engine | Epic: AI-Powered Product Recommendations | Labels: backend task, security task\n- **Access and Process User Profile & Purchase History Data**: Retrieve and process relevant data from existing user profiles and purchase history databases for input into the recommendation model.\n  Feature: Personalized Product Recommendation Engine | Epic: AI-Powered Product Recommendations | Labels: backend task, data task\n- **Integrate with Product Catalog API**: Connect the recommendation engine to the product catalog API to fetch current product data.\n  Feature: Personalized Product Recommendation Engine | Epic: AI-Powered Product Recommendations | Labels: backend task, api task\n- **Develop & Train Machine Learning Model**: Create, train, and validate the AI model to generate product recommendations based on user data.\n  Feature: Personalized Product Recommendation Engine | Epic: AI-Powered Product Recommendations | Labels: ai task, ml task, data-science task\n- **Optimize Performance for Speed & Scalability**: Ensure the recommendation system responds within 500ms and can handle 10,000 concurrent users.\n  Feature: Personalized Product Recommendation Engine | Epic: AI-Powered Product Recommendations | Labels: performance task, backend task\n- **Implement GDPR and CCPA Compliance**: Ensure all data used by the recommendation engine adheres to GDPR and CCPA requirements.\n  Feature: Personalized Product Recommendation Engine | Epic: AI-Powered Product Recommendations | Labels: compliance task, security task\n\n**Priority:** level\n**Feature:** Personalized Product Recommendation Engine\n**Epic:** AI-Powered Product Recommendations\n**Labels:** ai story, recommendations story, frontend story, backend story\n\n---\n\n## Notes\nAssumes the platform already has user accounts, a product catalog, and user interaction tracking. The AI model type and specific data sources require clarification. Authentication requirement added per stakeholder feedback.\n\n\nWhat would you like to work on next? I can help you refine these stories, estimate story points, or organize them into sprints."
}